Produto,Preco
cerveja campo largo com vinho red 500ml,"Valor R$: 16,59"
cerveja amstel puro malte lata 473ml,"Valor R$: 4,19"
cerveja dado bier weiss sleek lata 350ml com 6un,"Valor R$: 34,14"
cerveja barco garrafa 600ml,"Valor R$: 8,39"
cerveja dado bier weiss sleek lata 350ml com 12 unidades,"Valor R$: 68,28"
cerveja antarctica subzero lata 269ml,"Valor R$: 2,39"
cerveja brahma chopp lata 269ml,"Valor R$: 2,85"
cerveja colorado ribeirão lager garrafa 600ml,"Valor R$: 13,99"
cerveja budweiser zero long neck 330ml com 6un,"Valor R$: 30,90"
cerveja budweiser zero long neck 330ml com 24un,"Valor R$: 123,60"
cerveja brahma zero alcool long neck 355ml com 6,"Valor R$: 28,50"
cerveja dado bier extra malte lata 350ml com 12 unidades,"Valor R$: 49,80"
cerveja baden baden peach garrafa 600ml,"Valor R$: 8,99"
cerveja budweiser zero long neck 330ml,"Valor R$: 5,15"
cerveja brahma chopp lata 310ml com 15 unidades,"Valor R$: 40,60"
cerveja blue moon belgian white sleek lata 350ml,"Valor R$: 7,19"
cerveja caracu escura long neck 355ml com 6un,"Valor R$: 32,70"
cerveja amstel ultra lata 269ml com 12 unidades,"Valor R$: 38,28"
cerveja eisenbahn ipa lata 350ml,"Valor R$: 5,15"
cerveja eisenbahn ipa lata 350ml com 6un,"Valor R$: 30,90"
cerveja budweiser zero sleek lata 350ml,"Valor R$: 3,49"
cerveja brahma zero alcool long neck 355ml,"Valor R$: 4,75"
cerveja brahma malzebier long neck 355ml com 6un,"Valor R$: 30,90"
cerveja becks lager long neck 330ml,"Valor R$: 5,49"
