Produto,Preco
Energético Monster Lata 473ml,"Valor: R$ 8,28"
Energético Juice Monster Mango Loco Lata 473ml,"Valor: R$ 7,58"
Energético Juice Monster Khaos Lata 473ml,"Valor: R$ 8,48"
Energético Zero Açúcar Monster Ultra Paradise Lata 473ml,"Valor: R$ 8,48"
Energético Monster Ultra Lata 473ml,"Valor: R$ 7,58"
Energético Ultra Violet Zero Açúcar Monster Lata 473ml,"Valor: R$ 8,48"
Energético Absolutely Zero Monster Lata  473ml,"Valor: R$ 7,58"
Energético Lemon Monster Dragon Ice Tea Lata 473ml,"Valor: R$ 8,48"
